Name,Type,Inheritable,Effects,Detail,Level,Class,Restriction,Source,Potential Source
TZALIK,Damage,True,Deals major untyped spell damage to 1 enemy. Greatly bypasses Magic Defense with a chance to inflict Paralysis on target. Damage and Paralysis rate are reduced if learned by someone other than Iarumas.,Efficacy and Paralysis probability increased further based on skill level.,,,,Iarumas,
"Unending Deaths, Continuous Funerals",Active,,"Minor physical attack on 1 enemy. If the target is defeated, performs a minor physical attack to another enemy.",Efficacy increased based on skill level.,64,Ninja,Ninja-specific,,
Unstoppable Curiosity,Discipline,,Continuously increases each stat. Detect and Fear Tolerance increased further.,Detect and Fear Tolerance increased further based on skill level.,,,,Dino,
Untyped Resistance Weakening,Debuff,,"By whispering malicious things to surrounding entities, there is a chance of decreasing the untyped-type tolerance of 1 enemy row for 2 turns.",Probability increased and Untyped-type Resistance Weakening effect is further increased based on skill level. Additional turns incrementally added.,67,Mage,Mage/Mage of the Black Rod-specific,,
Untyped Thaumaturgy,Passive,,Reduces untyped damage to self.,Damage decreased further based on skill level.,55,Mage,,,
Unwavering Faith,Discipline,,Continuously increases each stat. Divine Power and Critical Evasion increased further.,Divine Power and Critical Tolerance increased further based on skill level.,,,,Galina,
Unyielding Will to Fight,Passive,True,Chance to cheat death with 1 HP when taking fatal damage (affected by luck).,Probability increased based on skill level.,35,Knight,,,Eulalia
Valiant Righteousness,Passive,,"<span style=""color: yellow"">Own Action Speed increased based on the number of one-handed swords and light armor equipped to self.</span> Increases damage to enemies for everyone in the user's row if it has only good or neutral allies.",,,,,Lanavaille,
Vengeful Oath Conditioning,Discipline,,"Continuously increases each stat, with Attack Power and Accuracy increased even further.",Attack Power and Accuracy increased further based on skill level.,,,,Gillion,
Vitality Jutsu,Passive,,Continuously increases attack power as thr current HP percentage increases.,Attack Power increased further based on skill level.,61,Ninja,,,
Voice Theft,Active,,"Marks an opponent, sealing away their voice, with a high chance of Spell-Binding 1 enemy for 2 turns.",Probability incrementally increased further based on skill level. More turns added.,22,Ninja,,,
Warrior Princess of Resolution and Love,Discipline,,Continuously increases each stat. Defense Power and Confusion/Charm Tolerance increased further.,Defense Power and Confusion/Charm Tolerance increased further based on skill level.,,,,Lanavaille,
Warrior's Battle Cry,Active,True,Increases own Attack Power and decreases Defense Power for 4 turns.,Attack Power increased further based on skill level.,8,Fighter,,Chloe,
Water Formation,Passive,,Increases damage to fire type enemies for user and adjacent water type allies if there are at least 2 water type allies adjacent to the user.,,,,,Flut,
Water Resistance Weakening,Debuff,,"By whispering malicious things to surrounding entities, there is a chance of decreasing the water-type tolerance of 1 enemy row for 2 turns.",Probability increased and Water-type Resistance Weakening effect is further increased based on skill level. Additional turns incrementally added.,67,Mage,Mage-specific,,
Water Type Thaumaturgy,Passive,,Reduces water-type damage to self.,Damage decreased further based on skill level.,55,Mage,,,
Water-Kin Blessing,Passive,,Reduces water type damage for humans in the same row.,,,,,Daniel,
Way of the Field of Battle,Discipline,,Continuously increases each stat. Evasion and Action Speed increased further.,Evasion and Action Speed increased further based on skill level.,,,,Ophelia,
Way of the Knight,Passive,True,Chance to reduce damage when user is attacked (affected by luck).,Probability increased while damage decreased incrementally based on skill level.,25,Knight,,,Alex
Way of the Mage,Passive,,Continuously reduces the MP cost of attack and debuff spells.,MP cost reduced further based on skill level.,25,Mage,,,
Way of the Priest,Passive,True,Reduces the MP cost of recovery and support spells.,MP cost reduced further based on skill level.,25,Priest,,,Marianne
Way of the Thief,Passive,,Increases decisive damage during a decisive hit.,Decisive damage increased further based on skill level.,25,Thief,,,
Way of the Warrior,Passive,True,Increases close-range damage when equipped with close or mid-range weapon.,Damage increased further based on skill level.,25,Fighter,,,"Gandolfo, Ophelia"
Wayfaring Hunter's Savvy,Passive,,"If there are 4 or more enemies during an ambush, for 1 turn, all allies greatly reduce damage taken 1 time.",,,,,Heinrico,
Weaponmaster,Discipline,,Continuously increases each stat. Accuracy and Surety increased further.,Accuracy and Surety increased further based on skill level.,,,,Gandolfo,
Wide Volley,Active,True,Minor physical attack on 1 enemy row. Efficacy Increases with Attack Power and Accuracy.,Efficacy increased based on skill level.,10,Ranger,Bow-specific,,Heinrico
Wild Knight,Passive,,Continuously reduces the MP/SP cost of Knight spells/skills that cost 3-10 MP/SP.,,,,,Barbara,
Wild Strike,Active,,"Major physical attack on 1 enemy. Afterward, own Action Speed is reduced.",Recovery amount increased based on skill level.,31,Fighter,Close/mid-range weapon-specific,,"Benjamin, Elise"
Wild Throw,Active,,Minor physical attack on 3 random enemies.,Efficacy increased based on skill level.,10,Ninja,"Long-range weapon-specific, Ninja-specific",,Kiriha
Will of the Millennial Lord,Discipline,,Continuously increases each stat. Magic Power and Action Speed increased further.,Magic Power and Action Speed increased further based on skill level.,,,,Adam,
Will to Fight,Passive,True,"Increases Accuracy, Evasion, and Surety when HP is below a certain level.",Adds more affected stats based on skill level and Effects increased further.,36,Fighter,,Olive,
Wisdom of the Crafty Old Dwarf,Discipline,,"Coninuously increases Detect, Evade Trap, Disarm Trap, and Trapophobia Tolerance. Detect, Evade Trap, Disarm Trap, and Trapophobia Tolerance increase amounts are reduced if learned by someone other than Aldric.","Detect, Evade Trap, Disarm Trap, and Trapophobia Tolerance increased further based on skill level.",,,,Aldric,
Wisdom of Truth,Passive,True,Eliminates dampening of damage from types the user is at a disadvantage with a chance to reduce damage when user is attacked (affected by Luck). Damage reduction amount/rate are reduced if learned by someone other than Adam.,"Incrementally adds MP up, with a chance to reduce damage when attacked, based on skill level. Probability increased and damage further reduced.",,,,Adam,
Witching Wisdom,Passive,,Increases the success of status afflictions and debuffs inflicted by the user.,,,,,Asha,
Young Spell Prodigy,Discipline,,"Continuously increases each stat, MP and Magic Power increased further.",MP and Magic Power increased further based on skill level.,,,,Flut,
ZELOS,Damage,,Launches an orb of condensed spite that deals minor dark spell damage to 1 enemy.,Efficacy increased based on skill level.,1,Mage,,,
ZILFIS,Support,,Words of prayer that cure 1 ally of Curse.,"Resistance up and HP recovery incrementally added based on skill level. Increased Resistance, area of Effects. and recovery amount.",29,Priest,,,

